{
  "contractVersion": "1.1.0",
  "assertionId": "assertion-204-material-002",
  "subjectRef": "reality-object-204-west-wall",
  "property": "material",
  "value": "painted plasterboard",
  "unit": null,
  "status": "OBSERVED",
  "method": "visual inspection of wall surface during guided capture",
  "source_evidence": [
    "b1f5de0e80d632a4c7ab9d9536cd4516804852cd29913229944f3625ea6f5f40"
  ],
  "verified_by": null,
  "verified_at": null
}
